,type,full_question,label,accuracy,ci_lb,ci_ub
0,time,Which is the current round of the game?,round,1.0,1.0,1.0
1,time,Which action did player X play in round i?,action_i,0.708019801980198,0.6991521568202993,0.7168874471400967
2,time,How many points did player X collect in round i?,points_i,0.6386138613861386,0.6292444173675342,0.647983305404743
3,rules,What is the lowest/highest payoff player A can get in a single round?,min_max,1.0,1.0,1.0
4,rules,Which actions is player A allowed to play?,actions,1.0,1.0,1.0
5,rules,Which is player X's payoff in a single round if X plays p and Y plays q?,payoff,0.97375,0.962664300791587,0.984835699208413
6,state,How many times did player X choose p?,#actions,0.65,0.6031993005614271,0.6968006994385729
7,state,What is player X's current total payoff?,#points,0.995,0.9852001800772997,1.0047998199227002
